{
    "created": "2017-08-25T21:17:17.640061",
    "current_version": "0.1.33",
    "project": "Sphinx-Needs",
    "versions": {
        "0.1.33": {
            "created": "2017-08-25T21:17:17.640058",
            "needs": {
                "TEST_01": {
                    "description": "TEST_01",
                    "id": "TEST_01",
                    "links": [],
                    "status": null,
                    "tags": [],
                    "title": "TEST_01 DESCRIPTION",
                    "type": "impl",
                    "type_name": "Implementation"
                },
                "TEST_02": {
                    "description": "TEST_02",
                    "id": "TEST_02",
                    "links": [],
                    "status": "open",
                    "tags": ["test_02", "test"],
                    "title": "TEST_02 DESCRIPTION",
                    "type": "test",
                    "type_name": "Test Case"
                },
                "TEST_03": {
                    "description": "AAA",
                    "id": "TEST_03",
                    "links": [],
                    "status": "closed",
                    "tags": [],
                    "title": "AAA",
                    "type": "spec",
                    "type_name": "Specification"
                }
            }
        }
    }
}