{
    "created": "2022-05-12T11:17:01.415971",
    "current_version": "0.7",
    "project": "Sphinx-Needs",
    "versions": {
        "0.7": {
            "created": "2022-05-12T11:17:01.415959",
            "filters": {},
            "filters_amount": 0,
            "needs": {
                "test_req": {
                    "amount": "",
                    "another_option": "",
                    "author": "",
                    "avatar": "",
                    "blocks": [],
                    "blocks_back": [],
                    "checks": [],
                    "checks_back": [],
                    "closed_at": "",
                    "comment": "",
                    "completion": "",
                    "config": "",
                    "created_at": "",
                    "description": "A requirement, which needs to be tested",
                    "docname": "directives/need",
                    "duration": "",
                    "ends_with": [],
                    "ends_with_back": [],
                    "external_css": "external_link",
                    "external_url": null,
                    "full_title": "test me",
                    "github": "",
                    "has_dead_links": "",
                    "has_forbidden_dead_links": "",
                    "hidden": "",
                    "hours": "",
                    "id": "test_req",
                    "id_complete": "test_req",
                    "id_parent": "test_req",
                    "id_prefix": "",
                    "image": "",
                    "is_external": false,
                    "is_modified": false,
                    "is_need": true,
                    "is_part": false,
                    "layout": "",
                    "links": [],
                    "max_amount": "",
                    "max_content_lines": "",
                    "modifications": 0,
                    "my_extra_option": "",
                    "parent_need": null,
                    "parent_needs": [],
                    "parent_needs_back": [],
                    "parts": {},
                    "post_template": null,
                    "pre_template": null,
                    "query": "",
                    "section_name": "extra links",
                    "sections": [
                        "extra links",
                        "links",
                        "Options",
                        "need/ req (or any other defined need type)"
                    ],
                    "service": "",
                    "signature": "",
                    "specific": "",
                    "starts_after": [],
                    "starts_after_back": [],
                    "starts_with": [],
                    "starts_with_back": [],
                    "status": null,
                    "style": null,
                    "tags": [],
                    "template": null,
                    "tests": [],
                    "tests_back": [
                        "test_001"
                    ],
                    "title": "test me",
                    "triggers": [],
                    "triggers_back": [],
                    "type": "req",
                    "type_name": "Requirement",
                    "updated_at": "",
                    "url": "",
                    "user": ""
                },
                "xyz_123": {
                    "amount": "",
                    "another_option": "filter_me",
                    "author": "",
                    "avatar": "",
                    "blocks": [],
                    "blocks_back": [],
                    "checks": [],
                    "checks_back": [],
                    "closed_at": "",
                    "comment": "",
                    "completion": "",
                    "config": "",
                    "created_at": "",
                    "description": "Some content",
                    "docname": "configuration",
                    "duration": "",
                    "ends_with": [],
                    "ends_with_back": [],
                    "external_css": "external_link",
                    "external_url": null,
                    "full_title": "My requirement with custom options",
                    "github": "",
                    "has_dead_links": "",
                    "has_forbidden_dead_links": "",
                    "hidden": "",
                    "hours": "",
                    "id": "xyz_123",
                    "id_complete": "xyz_123",
                    "id_parent": "xyz_123",
                    "id_prefix": "",
                    "image": "",
                    "is_external": false,
                    "is_modified": false,
                    "is_need": true,
                    "is_part": false,
                    "layout": "",
                    "links": [],
                    "max_amount": "",
                    "max_content_lines": "",
                    "modifications": 0,
                    "my_extra_option": "A new option",
                    "parent_need": null,
                    "parent_needs": [],
                    "parent_needs_back": [],
                    "parts": {},
                    "post_template": null,
                    "pre_template": null,
                    "query": "",
                    "section_name": "needs_extra_options",
                    "sections": [
                        "needs_extra_options",
                        "Options",
                        "Configuration"
                    ],
                    "service": "",
                    "signature": "",
                    "specific": "",
                    "starts_after": [],
                    "starts_after_back": [],
                    "starts_with": [],
                    "starts_with_back": [],
                    "status": "open",
                    "style": null,
                    "tags": [],
                    "template": null,
                    "tests": [],
                    "tests_back": [],
                    "title": "My requirement with custom options",
                    "triggers": [],
                    "triggers_back": [],
                    "type": "req",
                    "type_name": "Requirement",
                    "updated_at": "",
                    "url": "",
                    "user": ""
                }
            },
            "needs_amount": 2
        }
    }
}