{
    "created": "2021-05-11T13:54:22.331741",
    "current_version": "1.0",
    "project": "needs test docs",
    "versions": {
        "1.0": {
            "created": "2021-05-11T13:54:22.331724",
            "filters": {},
            "filters_amount": 0,
            "needs": {
                "TEST_01": {
                    "avatar": "",
                    "closed_at": "",
                    "completion": "",
                    "created_at": "",
                    "description": "TEST_01",
                    "docname": "index",
                    "duration": "",
                    "external_css": "external_link",
                    "external_url": "file:///home/daniel/workspace/sphinx/sphinxcontrib-needs/tests/doc_test/external_doc/__error__#TEST_01",
                    "full_title": "TEST_01 DESCRIPTION",
                    "hidden": "",
                    "id": "TEST_01",
                    "id_complete": "TEST_01",
                    "id_parent": "TEST_01",
                    "id_prefix": "",
                    "is_external": true,
                    "is_need": true,
                    "is_part": false,
                    "layout": null,
                    "links": ["SPEC_1"],
                    "max_amount": "",
                    "max_content_lines": "",
                    "parent_need": null,
                    "parent_needs": [],
                    "parent_needs_back": [],
                    "parts": {},
                    "post_template": null,
                    "pre_template": null,
                    "query": "",
                    "section_name": "",
                    "sections": [],
                    "service": "",
                    "signature": "",
                    "specific": "",
                    "status": null,
                    "style": null,
                    "tags": ["ext_test"],
                    "template": null,
                    "title": "TEST_01 DESCRIPTION",
                    "type": "impl",
                    "type_name": "Implementation",
                    "updated_at": "",
                    "url": "",
                    "user": ""
                },
                "TEST_02": {
                    "avatar": "",
                    "closed_at": "",
                    "completion": "",
                    "created_at": "",
                    "description": "TEST_02",
                    "docname": "index",
                    "duration": "",
                    "external_css": "external_link",
                    "external_url": "file:///home/daniel/workspace/sphinx/sphinxcontrib-needs/tests/doc_test/external_doc/__error__#TEST_02",
                    "full_title": "TEST_02 DESCRIPTION",
                    "hidden": "",
                    "id": "TEST_02",
                    "id_complete": "TEST_02",
                    "id_parent": "TEST_02",
                    "id_prefix": "",
                    "is_external": true,
                    "is_need": true,
                    "is_part": false,
                    "layout": null,
                    "links": [
                        "TEST_01"
                    ],
                    "max_amount": "",
                    "max_content_lines": "",
                    "parent_need": null,
                    "parent_needs": [],
                    "parent_needs_back": [],
                    "parts": {},
                    "post_template": null,
                    "pre_template": null,
                    "query": "",
                    "section_name": "",
                    "sections": [],
                    "service": "",
                    "signature": "",
                    "specific": "",
                    "status": "open",
                    "style": null,
                    "tags": ["ext_test"],
                    "template": null,
                    "title": "TEST_02 DESCRIPTION",
                    "type": "impl",
                    "type_name": "Implementation",
                    "updated_at": "",
                    "url": "",
                    "user": ""
                },
                "TEST_03": {
                    "avatar": "",
                    "closed_at": "",
                    "completion": "",
                    "created_at": "",
                    "description": "AAA",
                    "docname": "subpage_a/subpage_b/subpage",
                    "duration": "",
                    "external_css": "external_link",
                    "external_url": "file:///home/daniel/workspace/sphinx/sphinxcontrib-needs/tests/doc_test/external_doc/__error__#TEST_03",
                    "full_title": "AAA",
                    "hidden": "",
                    "id": "TEST_03",
                    "id_complete": "TEST_03",
                    "id_parent": "TEST_03",
                    "id_prefix": "",
                    "is_external": true,
                    "is_need": true,
                    "is_part": false,
                    "layout": null,
                    "links": [],
                    "max_amount": "",
                    "max_content_lines": "",
                    "parent_need": null,
                    "parent_needs": [],
                    "parent_needs_back": [],
                    "parts": {},
                    "post_template": null,
                    "pre_template": null,
                    "query": "",
                    "section_name": "",
                    "sections": [],
                    "service": "",
                    "signature": "",
                    "specific": "",
                    "status": "open",
                    "style": null,
                    "tags": ["ext_test"],
                    "template": null,
                    "title": "AAA",
                    "type": "impl",
                    "type_name": "Implementation",
                    "updated_at": "",
                    "url": "",
                    "user": ""
                }
            },
            "needs_amount": 3
        }
    }
}
